{
  "$schema": "https://json-schema.org/draft/2020-12/schema",
  "$id": "https://slopmower.invalid/schemas/v1/draft.schema.json",
  "title": "Draft",
  "type": "object",
  "required": ["id", "reviewId", "kind", "anchor", "requestId", "body", "requireApproval", "createdAt", "updatedAt"],
  "properties": {
    "id": {
      "$ref": "common.schema.json#/$defs/Ulid"
    },
    "reviewId": {
      "$ref": "common.schema.json#/$defs/Ulid"
    },
    "kind": {
      "enum": ["new_request", "reply"]
    },
    "anchor": {
      "anyOf": [
        {
          "$ref": "anchor.schema.json"
        },
        {
          "type": "null"
        }
      ],
      "description": "Null for a reply and for a general new_request."
    },
    "requestId": {
      "anyOf": [
        {
          "$ref": "common.schema.json#/$defs/Ulid"
        },
        {
          "type": "null"
        }
      ]
    },
    "body": {
      "$ref": "common.schema.json#/$defs/Markdown"
    },
    "requireApproval": {
      "type": "boolean",
      "description": "new_request: the request opens with requireApproval. Always false for a reply."
    },
    "createdAt": {
      "$ref": "common.schema.json#/$defs/DateTime"
    },
    "updatedAt": {
      "$ref": "common.schema.json#/$defs/DateTime"
    }
  },
  "allOf": [
    {
      "if": {
        "properties": {
          "kind": {
            "const": "new_request"
          }
        }
      },
      "then": {
        "properties": {
          "requestId": {
            "type": "null"
          }
        }
      },
      "else": {
        "properties": {
          "anchor": {
            "type": "null"
          },
          "requestId": {
            "$ref": "common.schema.json#/$defs/Ulid"
          },
          "requireApproval": {
            "const": false
          }
        }
      }
    }
  ]
}
