{
  "id": "01K6D0DRAFT000000000000003",
  "reviewId": "01K6B3A1B2C3D4E5F6G7H8J9KM",
  "kind": "new_request",
  "anchor": null,
  "requestId": null,
  "body": "Wrap long lines in the code view.",
  "requireApproval": false,
  "createdAt": "2026-09-29T07:16:00Z",
  "updatedAt": "2026-09-29T07:16:00Z"
}
