{
  "id": "01K6D0DRAFT000000000000002",
  "reviewId": "01K6B3A1B2C3D4E5F6G7H8J9KM",
  "kind": "reply",
  "anchor": null,
  "requestId": "01K6B3P2A9QRSTVWXYZ0123457",
  "body": "Keep the rounding mode configurable.",
  "requireApproval": false,
  "createdAt": "2026-09-29T07:15:00Z",
  "updatedAt": "2026-09-29T07:15:00Z"
}
