{
  "id": "01K6D0DRAFT000000000000001",
  "reviewId": "01K6B3A1B2C3D4E5F6G7H8J9KM",
  "kind": "new_request",
  "anchor": {
    "kind": "symbol",
    "path": "src/Billing/InvoiceTotals.php",
    "commitSha": "79f8595a4c1e2b3d5f6071829a3b4c5d6e7f8091",
    "blobSha": "3b18e512dba79e4c8300dd08aeb37f8e728b8dad",
    "range": {
      "startLine": 38,
      "endLine": 49
    },
    "symbol": {
      "language": "php",
      "kind": "method",
      "fqn": "App\\Billing\\InvoiceTotals::total()"
    },
    "snapshot": {
      "lines": ["    /**", "     * Sum of all invoice lines.", "     */", "    public function total(): float", "    {", "        $sum = 0.0;", "        foreach ($this->lines as $line) {", "            $sum += $line->amount;", "        }", "", "        return $sum;", "    }"],
      "truncated": false,
      "lineCount": 12,
      "before": ["    }", "", ""],
      "after": ["", "    public function tax(): float", "    {"],
      "normalizedHash": "sha256:4cd0f94b186ef4903963fa0397ae6175cd9f82d31d4512d8e9b67a2b3a0142f9"
    }
  },
  "requestId": null,
  "body": "Use `Money` instead of `float` for totals.",
  "requireApproval": false,
  "createdAt": "2026-09-29T07:12:00Z",
  "updatedAt": "2026-09-29T07:14:30Z"
}
